{
    "$schema": "http://json-schema.org/draft-06/schema#",
    "$ref": "#/definitions/Config",
    "definitions": {
        "Config": {
            "type": "object",
            "additionalProperties": true,
            "properties": {
                "DefaultProfile": {
                    "type": "string"
                },
                "MuteOnStartup": {
                    "type": ["integer","boolean"]
                },
                "Profiles": {
                    "type": "array",
                    "items": {
                        "$ref": "#/definitions/Profile"
                    }
                },
                "SwitchProfileOSD": {
                    "type": ["integer","boolean"]
                },
                "UseCustomSounds": {
                    "type": ["integer","boolean"]
                }
            },
            "required": [
                "DefaultProfile",
                "Profiles"
            ],
            "title": "Config"
        },
        "Profile": {
            "type": "object",
            "additionalProperties": true,
            "properties": {
                "afkTimeout": {
                    "type": "number"
                },
                "ExcludeFullscreen": {
                    "type": ["integer","boolean"]
                },
                "LinkedApp": {
                    "type": "string"
                },
                "Microphone": {
                    "type": "string"
                },
                "MuteHotkey": {
                    "type": "string"
                },
                "OnscreenFeedback": {
                    "type": ["integer","boolean"]
                },
                "OSDPos": {
                    "$ref": "#/definitions/OSDPos"
                },
                "ProfileName": {
                    "type": "string"
                },
                "PushToTalk": {
                    "type": ["integer","boolean"]
                },
                "PTTDelay": {
                    "type": "number"
                },
                "SoundFeedback": {
                    "type": ["integer","boolean"]
                },
                "UnmuteHotkey": {
                    "type": "string"
                },
                "UpdateWithSystem": {
                    "type": ["integer","boolean"]
                }
            },
            "required": [
                "Microphone",
                "MuteHotkey",
                "ProfileName",
                "PushToTalk",
                "UnmuteHotkey"
            ],
            "title": "Profile"
        },
        "OSDPos": {
            "type": "object",
            "additionalProperties": false,
            "properties": {
                "x": {
                    "type": "integer"
                },
                "y": {
                    "type": "integer"
                }
            },
            "required": [
                "x",
                "y"
            ],
            "title": "OSDPos"
        }
    }
}